{
  "schemaVersion": "1.0-plan",
  "status": "PLAN_ONLY_ALL_EFFECT_CIRCUITS_HELD",
  "migration": "0007_agent_runtime_effect_authority.sql",
  "migrationState": "DEFERRED",
  "authoritySource": "RUST_EMBEDDED_REVIEW_PINNED_MANIFEST",
  "bindings": [
    {
      "actionKind": "INSTALL",
      "circuitName": "install",
      "effectProfile": "INSTALL",
      "actionClass": "D",
      "approvalSchemaVersion": "2.0",
      "executorRole": "sirinx_agent_runtime_install_executor",
      "circuitState": "HOLD",
      "effectState": "PREPARED",
      "enabled": false,
      "executorAvailable": false,
      "routeRegistered": false
    },
    {
      "actionKind": "RESOURCE_CLEANUP",
      "circuitName": "resource_cleanup",
      "effectProfile": "RESOURCE_CLEANUP",
      "actionClass": "C",
      "approvalSchemaVersion": "2.0",
      "executorRole": "sirinx_agent_runtime_resource_cleanup_executor",
      "circuitState": "HOLD",
      "effectState": "PREPARED",
      "enabled": false,
      "executorAvailable": false,
      "routeRegistered": false
    },
    {
      "actionKind": "CONNECTOR_ACTIVATION",
      "circuitName": "connector_activation",
      "effectProfile": "CONNECTOR_ACTIVATION",
      "actionClass": "D",
      "approvalSchemaVersion": "2.0",
      "executorRole": "sirinx_agent_runtime_connector_activation_executor",
      "circuitState": "HOLD",
      "effectState": "PREPARED",
      "enabled": false,
      "executorAvailable": false,
      "routeRegistered": false
    },
    {
      "actionKind": "PROVIDER_CALL",
      "circuitName": "provider_call",
      "effectProfile": "PROVIDER_CALL",
      "actionClass": "D",
      "approvalSchemaVersion": "2.0",
      "executorRole": "sirinx_agent_runtime_provider_call_executor",
      "circuitState": "HOLD",
      "effectState": "PREPARED",
      "enabled": false,
      "executorAvailable": false,
      "routeRegistered": false
    },
    {
      "actionKind": "QUEUE_MUTATION",
      "circuitName": "queue_mutation",
      "effectProfile": "QUEUE_MUTATION",
      "actionClass": "D",
      "approvalSchemaVersion": "2.0",
      "executorRole": "sirinx_agent_runtime_queue_mutation_executor",
      "circuitState": "HOLD",
      "effectState": "PREPARED",
      "enabled": false,
      "executorAvailable": false,
      "routeRegistered": false
    },
    {
      "actionKind": "A2A_EGRESS",
      "circuitName": "a2a_egress",
      "effectProfile": "A2A_EGRESS",
      "actionClass": "D",
      "approvalSchemaVersion": "2.0",
      "executorRole": "sirinx_agent_runtime_a2a_egress_executor",
      "circuitState": "HOLD",
      "effectState": "PREPARED",
      "enabled": false,
      "executorAvailable": false,
      "routeRegistered": false
    },
    {
      "actionKind": "LIVE_SEND",
      "circuitName": "telegram_send",
      "effectProfile": "TELEGRAM",
      "actionClass": "D",
      "approvalSchemaVersion": "2.0",
      "executorRole": "sirinx_agent_runtime_telegram_send_executor",
      "circuitState": "HOLD",
      "effectState": "PREPARED",
      "enabled": false,
      "executorAvailable": false,
      "routeRegistered": false
    },
    {
      "actionKind": "LIVE_SEND",
      "circuitName": "customer_messaging",
      "effectProfile": "CUSTOMER_MESSAGING",
      "actionClass": "D",
      "approvalSchemaVersion": "2.0",
      "executorRole": "sirinx_agent_runtime_customer_messaging_executor",
      "circuitState": "HOLD",
      "effectState": "PREPARED",
      "enabled": false,
      "executorAvailable": false,
      "routeRegistered": false
    },
    {
      "actionKind": "PUSH",
      "circuitName": "push",
      "effectProfile": "PUSH",
      "actionClass": "D",
      "approvalSchemaVersion": "2.0",
      "executorRole": "sirinx_agent_runtime_push_executor",
      "circuitState": "HOLD",
      "effectState": "PREPARED",
      "enabled": false,
      "executorAvailable": false,
      "routeRegistered": false
    },
    {
      "actionKind": "MERGE",
      "circuitName": "merge",
      "effectProfile": "MERGE",
      "actionClass": "D",
      "approvalSchemaVersion": "2.0",
      "executorRole": "sirinx_agent_runtime_merge_executor",
      "circuitState": "HOLD",
      "effectState": "PREPARED",
      "enabled": false,
      "executorAvailable": false,
      "routeRegistered": false
    },
    {
      "actionKind": "PRODUCTION_MIGRATION",
      "circuitName": "production_migration",
      "effectProfile": "PRODUCTION_MIGRATION",
      "actionClass": "D",
      "approvalSchemaVersion": "2.0",
      "executorRole": "sirinx_agent_runtime_production_migration_executor",
      "circuitState": "HOLD",
      "effectState": "PREPARED",
      "enabled": false,
      "executorAvailable": false,
      "routeRegistered": false
    },
    {
      "actionKind": "CLOUDFLARE_MUTATION",
      "circuitName": "cloudflare_mutation",
      "effectProfile": "CLOUDFLARE_MUTATION",
      "actionClass": "D",
      "approvalSchemaVersion": "2.0",
      "executorRole": "sirinx_agent_runtime_cloudflare_mutation_executor",
      "circuitState": "HOLD",
      "effectState": "PREPARED",
      "enabled": false,
      "executorAvailable": false,
      "routeRegistered": false
    },
    {
      "actionKind": "DEPLOY",
      "circuitName": "deploy",
      "effectProfile": "DEPLOY",
      "actionClass": "D",
      "approvalSchemaVersion": "2.0",
      "executorRole": "sirinx_agent_runtime_deploy_executor",
      "circuitState": "HOLD",
      "effectState": "PREPARED",
      "enabled": false,
      "executorAvailable": false,
      "routeRegistered": false
    }
  ],
  "unboundEffectProfiles": [
    "LINE"
  ],
  "stopRules": [
    "migration-0007-deferred",
    "durable-authority-kernel-unavailable",
    "all-effect-circuits-held",
    "approval-consumption-disabled",
    "outbox-claim-disabled",
    "executors-unavailable",
    "b10-effect-routes-unregistered",
    "network-provider-and-message-io-disabled"
  ]
}
